{
  "version": "3.2",
  "id": "bench-016",
  "request": "Transform this person into a conserved Roman Imperial bronze portrait bust.",
  "route": "artifact_transform",
  "locks": {
    "adult_subject": true,
    "primary_subject": "same adult subject across transformations",
    "do_not_silently_add_rank_or_sacred_status": true
  },
  "references": [
    {
      "id": "ref-identity-01",
      "roles": [
        "identity"
      ],
      "notes": "Example placeholder identity reference; replace with actual asset ID/path."
    }
  ],
  "identity": {
    "mode": "strict_identity",
    "locked_features": [
      "recognizable facial structure"
    ]
  },
  "body_transformation": {
    "mode": "artistic_stylization",
    "anatomy_change": "none unless explicitly stated in request",
    "pose_change": "allowed as director choice",
    "camera_presentation": "allowed",
    "garment_shaping": "allowed when route requires it",
    "artistic_stylization": "only when selected by body mode/art method"
  },
  "historical": {
    "strictness": "historically_informed",
    "packs": [
      "roman_imperial"
    ],
    "subperiod": "2nd century CE-inspired",
    "region": "Roman Mediterranean",
    "role": "private elite portrait",
    "occasion": "portrait display",
    "intentional_hybrids": [
      "modern sitter mapped to Roman portrait convention"
    ]
  },
  "art": {
    "method": "bronze_sculpture",
    "artifact_form": "bust",
    "artifact_state": "museum_conserved",
    "variant": "individualized rather than emperor-like idealization"
  },
  "requested_elements": [],
  "director": {
    "moment": "newly installed in a museum case",
    "action": "frontal-three-quarter bust with subtle head turn",
    "gaze": "focused slightly off-axis",
    "body_weight": "not applicable beyond stable bust support",
    "hand_logic": "no hands in crop",
    "foreground": "dark bronze mount edge",
    "midground": "head, neck, shoulders and deliberate bust termination",
    "background": "neutral museum wall with soft falloff",
    "camera": "close museum portrait at eye level",
    "light_source": "controlled warm side key with cooler ambient fill",
    "material_response": "dark copper-alloy patina, rubbed high points, chased hair detail, localized green corrosion only in recesses",
    "micro_story": "an individualized private portrait rediscovered and conserved"
  },
  "output": {
    "profile": "standard",
    "aspect_ratio": "4:5",
    "text_in_image": [],
    "generation_requested": false
  }
}
