{
  "version": "3.2",
  "id": "bench-017",
  "request": "Turn the reference into a watercolor travel-memory image.",
  "route": "art_style_transform",
  "locks": {
    "adult_subject": true,
    "primary_subject": "same adult subject across transformations",
    "do_not_silently_add_rank_or_sacred_status": true
  },
  "references": [
    {
      "id": "ref-source-01",
      "roles": [
        "identity",
        "environment"
      ],
      "notes": "The single source image supplies the depicted person and travel-memory environment; no outfit/style import beyond visible source content unless requested."
    }
  ],
  "identity": {
    "mode": "identity_inspired",
    "locked_features": [
      "recognizable facial structure"
    ]
  },
  "body_transformation": {
    "mode": "artistic_stylization",
    "anatomy_change": "none unless explicitly stated in request",
    "pose_change": "allowed as director choice",
    "camera_presentation": "allowed",
    "garment_shaping": "allowed when route requires it",
    "artistic_stylization": "only when selected by body mode/art method"
  },
  "historical": {
    "strictness": "historically_informed",
    "packs": [],
    "subperiod": null,
    "region": null,
    "role": null,
    "occasion": null,
    "intentional_hybrids": []
  },
  "art": {
    "method": "watercolor",
    "artifact_form": "album_leaf",
    "artifact_state": "newly_created",
    "variant": null
  },
  "requested_elements": [],
  "director": {
    "moment": "the traveler pauses under a tree before a distant waterside path",
    "action": "small human figure integrated into landscape rather than dominating it",
    "gaze": "toward distant water/mountain space",
    "body_weight": "simple grounded stance",
    "hand_logic": "hands mostly contained by robe/gesture; no extra props unless source requires",
    "foreground": "dry-brush rock/tree texture",
    "midground": "small figure and path",
    "background": "mist/blank paper opening into distant landscape",
    "camera": "pictorial scroll space, no photographic lens language",
    "light_source": "paper and ink value rather than literal spotlight",
    "material_response": "calligraphic brush line, wet/dry ink, absorbent paper, reserved blank space",
    "micro_story": "a remembered journey reduced to brush rhythm and atmospheric absence"
  },
  "output": {
    "profile": "standard",
    "aspect_ratio": "2:3",
    "text_in_image": [],
    "generation_requested": false
  }
}
