{
  "version": "3.2",
  "id": "bench-012",
  "request": "Turn this portrait into an Edo-period blue-and-white ceramic artwork on a plate.",
  "route": "artifact_transform",
  "locks": {
    "adult_subject": true,
    "primary_subject": "same adult subject across transformations",
    "do_not_silently_add_rank_or_sacred_status": true
  },
  "references": [
    {
      "id": "ref-identity-01",
      "roles": [
        "identity"
      ],
      "notes": "Example placeholder identity reference; replace with actual asset ID/path."
    }
  ],
  "identity": {
    "mode": "recognizable_identity",
    "locked_features": [
      "recognizable facial structure"
    ]
  },
  "body_transformation": {
    "mode": "artistic_stylization",
    "anatomy_change": "none unless explicitly stated in request",
    "pose_change": "allowed as director choice",
    "camera_presentation": "allowed",
    "garment_shaping": "allowed when route requires it",
    "artistic_stylization": "only when selected by body mode/art method"
  },
  "historical": {
    "strictness": "historically_informed",
    "packs": [
      "edo"
    ],
    "subperiod": "Edo-period Japanese blue-and-white / Hizen-Arita-inspired rather than Ming court porcelain",
    "region": "Japan",
    "role": "portrait motif",
    "occasion": "decorative ceramic object",
    "intentional_hybrids": [
      "modern identity rendered as Edo Japanese ceramic decoration"
    ]
  },
  "art": {
    "method": "blue_white_ceramic",
    "artifact_form": "plate",
    "artifact_state": "aged",
    "variant": "Japanese underglaze-cobalt ceramic, not a Ming Jingdezhen copy"
  },
  "requested_elements": [],
  "director": {
    "moment": "historic plate shown in a museum study view",
    "action": "portrait motif rendered as a bust/half figure integrated into central medallion",
    "gaze": "simplified sideward gaze within brush decoration",
    "body_weight": "not literal; implied pictorially",
    "hand_logic": "omit hands unless they fit the plate field cleanly",
    "foreground": "plate rim close to camera",
    "midground": "central cobalt portrait and border motifs",
    "background": "neutral museum surface",
    "camera": "slight oblique to reveal curvature and glaze",
    "light_source": "soft side light creating glaze reflection without obscuring cobalt",
    "material_response": "cobalt underglaze beneath transparent glaze, brush-density variation, slight firing/age irregularity",
    "micro_story": "a portrait preserved as a handled decorative object rather than a printed photograph"
  },
  "output": {
    "profile": "standard",
    "aspect_ratio": "1:1",
    "text_in_image": [],
    "generation_requested": false
  }
}
