{
  "version": "3.2",
  "id": "bench-009",
  "request": "Turn this portrait into a Tang-period Dunhuang-inspired cave mural artifact.",
  "route": "artifact_transform",
  "locks": {
    "adult_subject": true,
    "primary_subject": "same adult subject across transformations",
    "do_not_silently_add_rank_or_sacred_status": true
  },
  "references": [
    {
      "id": "ref-identity-01",
      "roles": [
        "identity"
      ],
      "notes": "Example placeholder identity reference; replace with actual asset ID/path."
    }
  ],
  "identity": {
    "mode": "recognizable_identity",
    "locked_features": [
      "recognizable facial structure"
    ]
  },
  "body_transformation": {
    "mode": "artistic_stylization",
    "anatomy_change": "none unless explicitly stated in request",
    "pose_change": "allowed as director choice",
    "camera_presentation": "allowed",
    "garment_shaping": "allowed when route requires it",
    "artistic_stylization": "only when selected by body mode/art method"
  },
  "historical": {
    "strictness": "historically_informed",
    "packs": [
      "dunhuang",
      "tang"
    ],
    "subperiod": "Tang-period Mogao-inspired, not a specific sacred icon unless separately sourced",
    "region": "Mogao/Dunhuang",
    "role": "secular donor/attendant-inspired portrait rather than deity",
    "occasion": "painted cave-wall portrait zone",
    "intentional_hybrids": [
      "modern identity translated into a Tang-period Dunhuang-inspired non-sacred figure"
    ]
  },
  "art": {
    "method": "mineral_pigment_mural",
    "artifact_form": "architectural_frieze",
    "artifact_state": "aged",
    "variant": "matte cave-wall mural"
  },
  "requested_elements": [],
  "director": {
    "moment": "surviving wall section under conservation lighting",
    "action": "graceful three-quarter attendant/donor-inspired standing pose",
    "gaze": "calm sideward gaze",
    "body_weight": "flattened pictorial stance with readable but non-photographic anatomy",
    "hand_logic": "simple hands close to torso; no sacred mudra",
    "foreground": "edge of plaster loss",
    "midground": "painted figure and textile motifs",
    "background": "restrained mural field, no fake deep cave bokeh",
    "camera": "orthographic-to-slight oblique documentation view",
    "light_source": "soft conservation/documentation light revealing plaster relief",
    "material_response": "matte mineral pigment integrated with plaster, localized cracking and paint loss",
    "micro_story": "a surviving secular portrait fragment whose identity remains recognizable through painted facial structure"
  },
  "output": {
    "profile": "standard",
    "aspect_ratio": "4:5",
    "text_in_image": [],
    "generation_requested": false
  }
}
