{
  "version": "3.2",
  "id": "bench-015",
  "request": "Turn the portrait into a museum-quality Classical Greek marble statue while keeping the person recognizable.",
  "route": "artifact_transform",
  "locks": {
    "adult_subject": true,
    "primary_subject": "same adult subject across transformations",
    "do_not_silently_add_rank_or_sacred_status": true
  },
  "references": [
    {
      "id": "ref-identity-01",
      "roles": [
        "identity"
      ],
      "notes": "Example placeholder identity reference; replace with actual asset ID/path."
    }
  ],
  "identity": {
    "mode": "strict_identity",
    "locked_features": [
      "recognizable facial structure"
    ]
  },
  "body_transformation": {
    "mode": "artistic_stylization",
    "anatomy_change": "none unless explicitly stated in request",
    "pose_change": "allowed as director choice",
    "camera_presentation": "allowed",
    "garment_shaping": "allowed when route requires it",
    "artistic_stylization": "only when selected by body mode/art method"
  },
  "historical": {
    "strictness": "historically_informed",
    "packs": [
      "classical_greek"
    ],
    "subperiod": "Classical",
    "region": null,
    "role": "idealized heroic portrait subject",
    "occasion": "sculptural dedication",
    "intentional_hybrids": [
      "modern sitter translated into Classical sculptural language"
    ]
  },
  "art": {
    "method": "marble_sculpture",
    "artifact_form": "free_standing_statue",
    "artifact_state": "museum_conserved",
    "variant": "restrained traces of historically plausible polychromy optional, not mandatory"
  },
  "requested_elements": [],
  "director": {
    "moment": "museum display after conservation",
    "action": "stable free-standing heroic pose with drapery supporting the composition",
    "gaze": "calm forward focus",
    "body_weight": "clear load-bearing leg and relaxed counter-leg",
    "hand_logic": "hands simplified into stone-safe gestures; no unsupported thin fingers",
    "foreground": "stone plinth and subtle conservation mount",
    "midground": "full statue",
    "background": "quiet museum gallery",
    "camera": "three-quarter museum documentation view with slight human eye-level perspective",
    "light_source": "warm museum key plus soft ambient fill",
    "material_response": "crystalline marble, polished high points, restrained tool texture in recesses",
    "micro_story": "a modern identity reimagined as an archaeological-style sculptural dedication"
  },
  "output": {
    "profile": "standard",
    "aspect_ratio": "4:5",
    "text_in_image": [],
    "generation_requested": false
  }
}
